{"added_profile_keys":["pcre2-dfa"],"campaign_manifest_id":"rcid:v1:campaign-manifest:h:jcs-sha256-v1:a0e031d0a7745602c970a8fafe1c2dfedd866a9b59ad30545efffdaf3574ddc1","candidate_count":48,"categories":[{"category":"capture","logical_execution_count":3,"selection_keys":["pcre2-ordinary","python-re"],"vector_keys":["capture-participation-octets","capture-participation-unicode"]},{"category":"error","logical_execution_count":7,"selection_keys":["mysql-regex","pcre2-dfa","pcre2-ordinary","python-re"],"vector_keys":["compile-rejection-octets","compile-rejection-unicode","target-timeout-unicode"]},{"category":"iteration","logical_execution_count":2,"selection_keys":["pcre2-ordinary","python-re"],"vector_keys":["zero-length-find-all-octets"]},{"category":"profile-differential","logical_execution_count":3,"selection_keys":["pcre2-dfa","pcre2-ordinary","python-re"],"vector_keys":["dfa-leftmost-longest-octets"]},{"category":"rejection","logical_execution_count":5,"selection_keys":["mysql-regex","pcre2-dfa","pcre2-ordinary","python-re"],"vector_keys":["compile-rejection-octets","compile-rejection-unicode"]},{"category":"replacement","logical_execution_count":2,"selection_keys":["mysql-regex","python-re"],"vector_keys":["replace-all-unicode"]},{"category":"success","logical_execution_count":19,"selection_keys":["mysql-regex","pcre2-dfa","pcre2-ordinary","python-re"],"vector_keys":["capture-participation-octets","capture-participation-unicode","dfa-leftmost-longest-octets","no-match-unicode","positive-octets-search","positive-unicode-search","replace-all-unicode","unicode-astral-span","zero-length-find-all-octets"]},{"category":"timeout","logical_execution_count":2,"selection_keys":["mysql-regex","python-re"],"vector_keys":["target-timeout-unicode"]},{"category":"unicode","logical_execution_count":13,"selection_keys":["mysql-regex","python-re"],"vector_keys":["capture-participation-unicode","compile-rejection-unicode","no-match-unicode","positive-unicode-search","replace-all-unicode","target-timeout-unicode","unicode-astral-span"]}],"classification":{"normative_authority":false,"operational_qualification_only":true,"semantic_authority":false},"excluded_count":22,"included_count":26,"invalid_count":0,"profile_coordinate_count":4,"schema_version":"qualification-coverage-report.v1","selection_keys":["mysql-regex","pcre2-dfa","pcre2-ordinary","python-re"],"unresolved_count":0,"vector_count":12}
